{
  "schema_version": 1,
  "profile_id": "personal-server",
  "server": {
    "host": "100.64.10.20",
    "ssh_port": 22,
    "ssh_user": "codex-tunnel",
    "host_fingerprints": [
      "SHA256:AAAAAAAAAAAAAAAAAAAAAAAAAAAAAAAAAAAAAAAAAAA"
    ]
  },
  "gateway": {
    "remote_host": "127.0.0.1",
    "remote_port": 18319
  },
  "client": {
    "local_port": 18317,
    "codex_profile": "codex-via-server",
    "minimum_client_version": "0.2.0",
    "minimum_codex_version": "0.149.1"
  },
  "approved_device": {
    "device_id": "mac-mini-office",
    "public_key_fingerprint": "SHA256:BBBBBBBBBBBBBBBBBBBBBBBBBBBBBBBBBBBBBBBBBBB"
  },
  "issued_at": "2026-08-31T05:40:00Z"
}
